{
  "node_id": "gw_test_01",
  "snapshot_id": "snap_vector_42",
  "observed_generation": 42,
  "applied_generation": 41,
  "runtime_applied": false,
  "result": "apply_failed_rolled_back",
  "diff": {
    "status": "unavailable",
    "equal": false,
    "projected_peers": 1,
    "current_peers": 0,
    "missing_peers": 0,
    "unexpected_peers": 0,
    "route_mismatches": 0
  }
}
